{
  "category": "digital_crimes",
  "prominent_incident_type": ["Data Breach and Customer Information Theft"],
  "all_incident_hits": [
    ["Insider Trading and Securities Fraud"],
    ["Data Breach and Customer Information Theft"],
    ["Online Fraud Schemes: Phishing and Identity Theft"],
    ["Data Breach and Customer Information Theft"],
    ["Data Breach and Customer Information Theft"],
    ["Data Breach and Customer Information Theft"],
    ["Cyberbullying and Harrasment"],
    ["Cyberbullying and Harrasment"],
    ["Online Fraud Schemes: Phishing and Identity Theft"],
    ["Online Fraud Schemes: Phishing and Identity Theft"],
    ["Data Breach and Customer Information Theft"],
    ["Data Breach and Customer Information Theft"],
    ["Data Breach and Customer Information Theft"],
    ["Cyberbullying and Harrasment"],
    ["Data Breach and Customer Information Theft"],
    ["Drug Trafficking and Communications"],
    ["Data Breach and Customer Information Theft"],
    ["Drug Trafficking and Communications"]
  ],
  "overall_sentiments": ["negative"],
  "all_sentiment_hits": [
    ["negative"],
    ["negative"],
    ["negative"],
    ["neutral"],
    ["negative"],
    ["negative"],
    ["negative"],
    ["negative"],
    ["negative"],
    ["negative"],
    ["negative"],
    ["neutral"],
    ["negative"],
    ["negative"],
    ["negative"],
    ["negative"],
    ["positive"],
    ["neutral"]
  ],
  "analysis_results": {
    "named_entities": [
      ["@Greedypants", "ORG"],
      ["555-1234", "DATE"],
      ["@Greedypants", "ORG"],
      ["IP", "ORG"],
      ["123.456.789.012", "CARDINAL"],
      ["Joe's Coffee Shop", "FAC"],
      ["123", "CARDINAL"],
      ["Fake Street", "FAC"],
      ["Crimeville", "GPE"],
      ["@Greedypants", "ORG"]
    ],
    "noun_phrases": [
      "you",
      "the insider trading saga",
      "I",
      "this wannabe financial wizard",
      "'s",
      "him",
      "@Greedypants",
      "he",
      "the cash",
      "Picture",
      "this dude",
      "a shady office",
      "piles",
      "classified docs",
      "screens galore",
      "He",
      "he",
      "some kind",
      "genius",
      "boy",
      "he",
      "a rude awakening!Now",
      "the real kicker",
      "@Greedypants",
      "the dumbest move",
      "a phone call",
      "you",
      "he",
      "his plans",
      "no one",
      "what",
      "Our top-notch crime detection model",
      "all ears",
      "any wrongdoing",
      "that call",
      "all the beans",
      "He",
      "a bunch",
      "companies",
      "he",
      "his own gain",
      "he",
      "some stock market puppet master",
      "it",
      "his own @username",
      "a social media platform",
      "world",
      "me",
      "action",
      "my username",
      "I",
      "my head",
      "his audacity",
      "it",
      "This mastermind",
      "nonsense",
      "his phone number",
      "he",
      "someone",
      "him",
      "insider trading tips",
      "me",
      "'s",
      "illegal money rain",
      "you",
      "the nerve?Oh",
      "he",
      "He",
      "his email address",
      "he",
      "he",
      "some shady newsletter empire",
      "all your dirty dealings",
      "me",
      "anyone",
      "that address",
      "their lunch money",
      "their illegal plans",
      "this",
      "he",
      "URLs",
      "they",
      "party favors",
      "What a joke",
      "It",
      "he",
      "people",
      "him",
      "his shady ways",
      "that",
      "@Greedypants",
      "the genius idea",
      "his IP address",
      "me",
      "you",
      "illegal dreams",
      "that",
      "the exact address",
      "you",
      "my drift",
      "The guy",
      "neon signs",
      "his secret lair",
      "it",
      "all",
      "this clueless wonder",
      "specific locations",
      "he",
      "his \"partners",
      "crime",
      "'s",
      "Joe's Coffee Shop",
      "123 Fake Street",
      "Crimeville",
      "I",
      "he",
      "he",
      "a playdate",
      "illegal activities?Thanks",
      "our rockstar crime detection model",
      "@Greedypants",
      "his insider trading circus",
      "you",
      "fraud",
      "Moral",
      "the story",
      "cutting-edge tech",
      "you",
      "your personal info",
      "financial crimes",
      "This guy",
      "stupidity",
      "a whole new level"
    ],
    "phone_numbers": [],
    "email_addresses": ["greedymastermind@scammyemail.com"],
    "urls": [],
    "ip_addresses": ["123.456.789.012"],
    "dates": ["555-1234"],
    "file_names": [
      "wrongdoing.During",
      "audacity.But",
      "scammyemail.com",
      "plans.And",
      "www.getfilthyrichnow.com",
      "ways.If",
      "123.456.789.012",
      "lair.To"
    ],
    "locations": ["Crimeville"],
    "usernames": [
      "@Greedypants",
      "@Greedypants",
      "@Greedypants",
      "@username",
      "@GreedIsGood",
      "@scammyemail",
      "@Greedypants",
      "@Greedypants"
    ],
    "key_phrases": [
      "the insider trading saga",
      "insider trading tips",
      "illegal money rain",
      "their illegal plans",
      "illegal dreams",
      "123 Fake Street",
      "illegal activities?Thanks",
      "his insider trading circus",
      "fraud",
      "financial crimes"
    ],
    "context_sentences": [
      "Hey, you won't believe the insider trading saga I stumbled upon.",
      "Catch me in action on 'ScammersRUs,' my username is @GreedIsGood!\"",
      "\"For insider trading tips, hit me up at 555-1234.",
      "Let's make illegal money rain!\"",
      "\"For all your dirty dealings, email me at greedymastermind@scammyemail.com.\"",
      "Like anyone would trust that address with their lunch money, let alone their illegal plans.",
      "\"Come catch me if you can at 123.456.789.012, where illegal dreams come true!\"",
      "\"Let's rendezvous at Joe's Coffee Shop, 123 Fake Street, Crimeville.\"",
      "Did he think he was organizing a playdate instead of plotting illegal activities?Thanks to our rockstar crime detection model, @Greedypants and his insider trading circus got shut down faster than you can say \"arrested for fraud.\"",
      "Don't mess with cutting-edge tech, especially if you're foolish enough to mockingly drop your personal info while engaging in financial crimes."
    ]
  },
  "transcribed_text": "Hey, you won't believe the insider trading saga I stumbled upon. So there's this wannabe financial wizard, let's call him @Greedypants, because he's all about the cash. Picture this dude sitting in a shady office, surrounded by piles of classified docs and screens galore. He thinks he's some kind of genius, but boy, is he in for a rude awakening!Now, here's the real kicker. @Greedypants made the dumbest move ever during a phone call. Can you believe he actually blurted out his plans, thinking no one would listen? Well, guess what? Our top-notch crime detection model was all ears, ready to pounce on any wrongdoing.During that call, @Greedypants spilled all the beans. He namedropped a bunch of companies he was scheming to manipulate for his own gain, like he was some stock market puppet master. But here's where it gets even crazier\u00e2\u20ac\u201dhe also dropped his own @username on a social media platform. Like, seriously? \"Hey, world! Catch me in action on 'ScammersRUs,' my username is @GreedIsGood!\" I couldn't help but shake my head at his audacity.But wait, it gets even more ridiculous. This mastermind of nonsense also shared his phone number, as if he was begging for someone to report him. \"For insider trading tips, hit me up at 555-1234. Let's make illegal money rain!\" Can you believe the nerve?Oh, and he didn't stop there. He casually mentioned his email address, because apparently, he thought he was running some shady newsletter empire. \"For all your dirty dealings, email me at greedymastermind@scammyemail.com.\" Yeah, right. Like anyone would trust that address with their lunch money, let alone their illegal plans.And get this, he even threw in URLs like they were party favors. \"Looking to get rich quick and dirty? Check out www.getfilthyrichnow.com.\" What a joke! It's like he wanted people to find him and expose his shady ways.If that wasn't enough, @Greedypants had the genius idea of mentioning his IP address. \"Come catch me if you can at 123.456.789.012, where illegal dreams come true!\" Okay, maybe that's not the exact address, but you catch my drift. The guy might as well have put up neon signs pointing to his secret lair.To top it all off, this clueless wonder shared specific locations where he'd meet his \"partners in crime.\" \"Let's rendezvous at Joe's Coffee Shop, 123 Fake Street, Crimeville.\" I mean, seriously? Did he think he was organizing a playdate instead of plotting illegal activities?Thanks to our rockstar crime detection model, @Greedypants and his insider trading circus got shut down faster than you can say \"arrested for fraud.\" Moral of the story? Don't mess with cutting-edge tech, especially if you're foolish enough to mockingly drop your personal info while engaging in financial crimes. This guy took stupidity to a whole new level!"
}
