{
    "category": "digital_crimes",
    "prominent_incident_type": [
        "Drug Trafficking and Communications"
    ],
    "all_incident_hits": [
        [
            "Drug Trafficking and Communications"
        ],
        [
            "Drug Trafficking and Communications"
        ],
        [
            "Drug Trafficking and Communications"
        ],
        [
            "Data Breach and Customer Information Theft"
        ],
        [
            "Drug Trafficking and Communications"
        ],
        [
            "Online Fraud Schemes: Phishing and Identity Theft"
        ],
        [
            "Drug Trafficking and Communications"
        ],
        [
            "Drug Trafficking and Communications"
        ]
    ],
    "overall_sentiments": [
        "positive"
    ],
    "all_sentiment_hits": [
        [
            "positive"
        ],
        [
            "neutral"
        ],
        [
            "positive"
        ],
        [
            "positive"
        ],
        [
            "neutral"
        ],
        [
            "neutral"
        ],
        [
            "negative"
        ],
        [
            "negative"
        ]
    ],
    "analysis_results": {
        "named_entities": [
            [
                "one",
                "CARDINAL"
            ]
        ],
        "noun_phrases": [
            "we",
            "our communications",
            "the drug trafficking operation",
            "It",
            "a secure and covert channel",
            "any suspicions",
            "you",
            "those encrypted messaging apps",
            "We",
            "them",
            "our conversations",
            "sensitive information",
            "We",
            "a private group",
            "a unique code",
            "each type",
            "drug",
            "we",
            "someone",
            "our messages",
            "they",
            "a thing",
            "we",
            "the logistics",
            "the operation",
            "The drop-off point",
            "law enforcement",
            "us",
            "'s",
            "a rotation schedule",
            "the suppliers",
            "the changes",
            "We",
            "any unexpected surprises",
            "we",
            "our transportation methods",
            "the same routes",
            "suspicion",
            "different smuggling techniques",
            "I",
            "some folks",
            "hidden compartments",
            "vehicles",
            "even drones",
            "aerial deliveries",
            "We",
            "some research",
            "what options",
            "us",
            "discretion",
            "this business",
            "We",
            "whom",
            "we",
            "our communications",
            "'s",
            "the authorities",
            "this drug trafficking operation airtight"
        ],
        "phone_numbers": [],
        "email_addresses": [],
        "urls": [],
        "ip_addresses": [],
        "dates": [],
        "file_names": [
            "thing.Also",
            "surprises.Furthermore",
            "us.Remember"
        ],
        "locations": [],
        "usernames": [],
        "key_phrases": [
            "the drug trafficking operation",
            "drug",
            "this drug trafficking operation airtight"
        ],
        "context_sentences": [
            "Hey, man, we need to be careful with our communications regarding the drug trafficking operation.",
            "We can create a private group and set up a unique code for each type of drug we're dealing with.",
            "The drop-off point needs to be changed frequently to prevent law enforcement from tracking us.",
            "Let's stay one step ahead of the authorities and make this drug trafficking operation airtight."
        ]
    },
    "transcribed_text": "Hey, man, we need to be careful with our communications regarding the drug trafficking operation. It's crucial to maintain a secure and covert channel to avoid any suspicions. Have you heard about those encrypted messaging apps? We should start using them to encrypt our conversations and share sensitive information. We can create a private group and set up a unique code for each type of drug we're dealing with. This way, if someone intercepts our messages, they won't understand a thing.Also, we need to discuss the logistics of the operation. The drop-off point needs to be changed frequently to prevent law enforcement from tracking us. Let's establish a rotation schedule and ensure the suppliers are aware of the changes. We don't want any unexpected surprises.Furthermore, we should consider diversifying our transportation methods. Using the same routes repeatedly can raise suspicion. How about exploring different smuggling techniques? I've heard some folks have been successful using hidden compartments in vehicles or even drones for aerial deliveries. We should do some research and see what options are viable for us.Remember, discretion is paramount in this business. We must be cautious with whom we trust and ensure that our communications are secure. Let's stay one step ahead of the authorities and make this drug trafficking operation airtight."
}